{
  "$schema": "https://json-schema.org/draft/2020-12/schema",
  "title": "PlaceOrder",
  "description": "PlaceOrder schema from Burger King's Partners API",
  "$id": "https://raw.githubusercontent.com/api-evangelist/restaurant-brands/refs/heads/main/json-schema/channel-place-order-schema.json",
  "type": "object",
  "properties": {
    "externalReferenceId": {
      "$ref": "#/components/schemas/ExternalReferenceId"
    },
    "storeId": {
      "$ref": "#/components/schemas/StoreId"
    },
    "serviceMode": {
      "$ref": "#/components/schemas/ServiceMode"
    },
    "cart": {
      "$ref": "#/components/schemas/Cart"
    },
    "customer": {
      "$ref": "#/components/schemas/Customer"
    },
    "charges": {
      "$ref": "#/components/schemas/Charges"
    },
    "deliveryAddress": {
      "$ref": "#/components/schemas/Address"
    },
    "paymentMethod": {
      "$ref": "#/components/schemas/PaymentMethod"
    },
    "fireOrderInSeconds": {
      "$ref": "#/components/schemas/FireOrderInSeconds"
    },
    "readyInSeconds": {
      "$ref": "#/components/schemas/ReadyInSeconds"
    },
    "mpfOrderId": {
      "$ref": "#/components/schemas/MpfOrderId"
    }
  },
  "required": [
    "storeId",
    "serviceMode",
    "cart",
    "customer",
    "paymentMethod",
    "fireOrderInSeconds"
  ]
}